{
  "$schema": "schemas/v2/config.json",
  "data": {
    "checksum": "b68abc8d40b937d377aa7357bff66a1f4f5196da5b867f7ca88d02b37d2ebb5c",
    "source": "https://github.com/imperialCHEPI/healthgps-data/releases/download/20240624/data_20240624.zip"
  },
  "inputs": {
    "dataset": {
      "columns": {
        "Age": "integer",
        "Age2": "integer",
        "Age3": "integer",
        "Carbohydrate": "double",
        "EnergyIntake": "double",
        "Fat": "double",
        "Gender": "integer",
        "Height": "double",
        "Income": "integer",
        "PhysicalActivity": "double",
        "Protein": "double",
        "Sector": "integer",
        "Sodium": "double",
        "Weight": "double"
      },
      "delimiter": ",",
      "encoding": "ASCII",
      "format": "csv",
      "name": "../../../hgps_main_examples/Dummy_disease_test/India.DataFile.csv"
    },
    "settings": {
      "age_range": [
        0,
        100
      ],
      "country_code": "IND",
      "size_fraction": 0.0001
    }
  },
  "modelling": {
    "baseline_adjustments": {
      "delimiter": ",",
      "encoding": "ASCII",
      "file_names": {
        "factorsmean_female": "../../../hgps_main_examples/Dummy_disease_test/FactorsMean.Female.csv",
        "factorsmean_male": "../../../hgps_main_examples/Dummy_disease_test/FactorsMean.Male.csv"
      },
      "format": "csv"
    },
    "risk_factor_models": {
      "dynamic": "../../../hgps_main_examples/Dummy_disease_test/dynamic_model.json",
      "static": "../../../hgps_main_examples/Dummy_disease_test/static_model.json"
    },
    "risk_factors": [
      {
        "level": 0,
        "name": "Gender",
        "range": [
          0,
          1
        ]
      },
      {
        "level": 0,
        "name": "Age",
        "range": [
          0,
          100
        ]
      },
      {
        "level": 1,
        "name": "Sodium",
        "range": [
          984.7666,
          8844.316
        ]
      },
      {
        "level": 3,
        "name": "BMI",
        "range": [
          13.88,
          39.48983
        ]
      }
    ],
    "ses_model": {
      "function_name": "normal",
      "function_parameters": [
        0.0,
        1.0
      ]
    }
  },
  "output": {
    "comorbidities": 5,
    "file_name": "HealthGPS_Result_{TIMESTAMP}.json",
    "folder": "${HOME}/healthgps/example_diseases_output"
  },
  "project_requirements": {
    "demographics": {
      "age": true,
      "ethnicity": false,
      "gender": true,
      "gender2": "male",
      "region": false
    },
    "income": {
      "adjust_to_factors_mean": false,
      "categories": "3",
      "enabled": true,
      "income_based_csv_output": true,
      "trended": false,
      "type": "categorical"
    },
    "physical_activity": {
      "adjust_to_factors_mean": false,
      "enabled": true,
      "trended": false,
      "type": "simple"
    },
    "risk_factors": {
      "adjust_to_factors_mean": true,
      "trended": true
    },
    "trend": {
      "enabled": false,
      "type": "null"
    },
    "two_stage": {
      "use_logistic": false
    }
  },
  "running": {
    "diseases": [
      "intracerebralhemorrhage",
      "ischemicheartdisease",
      "ischemicstroke",
      "subarachnoidhemorrhage",
      "stomachcancer"
    ],
    "interventions": {
      "active_type_id": "simple",
      "types": {
        "simple": {
          "active_period": {
            "finish_time": null,
            "start_time": 2022
          },
          "impact_type": "absolute",
          "impacts": []
        }
      }
    },
    "seed": 12345,
    "start_time": 2022,
    "stop_time": 2030,
    "trial_runs": 1
  },
  "version": 2
}
