{
 "$schema": "schemas/v2/config.json",
 "data": {
  "checksum": "b68abc8d40b937d377aa7357bff66a1f4f5196da5b867f7ca88d02b37d2ebb5c",
  "source": "https://github.com/imperialCHEPI/healthgps-data/releases/download/20240624/data_20240624.zip"
 },
 "inputs": {
  "dataset": {
   "columns": {
    "Age": "integer",
    "Age2": "integer",
    "Age3": "integer",
    "BMI": "double",
    "Energy": "double",
    "Fat": "double",
    "Gender": "integer",
    "PA": "double",
    "Protein": "double",
    "SES": "double",
    "Sodium": "double",
    "Year": "integer"
   },
   "delimiter": ",",
   "encoding": "ASCII",
   "format": "csv",
   "name": "../../../hgps_main_examples/HLM_India/India.DataFile.csv"
  },
  "settings": {
   "age_range": [
    0,
    100
   ],
   "country_code": "IND",
   "size_fraction": 0.001
  }
 },
 "modelling": {
  "baseline_adjustments": {
   "delimiter": ",",
   "encoding": "ASCII",
   "file_names": {
    "factorsmean_female": "../../../hgps_main_examples/HLM_India/India.FactorsMean.Female.csv",
    "factorsmean_male": "../../../hgps_main_examples/HLM_India/India.FactorsMean.Male.csv"
   },
   "format": "csv"
  },
  "risk_factor_models": {
   "dynamic": "../../../hgps_main_examples/HLM_India/dynamic_model.json",
   "static": "../../../hgps_main_examples/HLM_India/static_model.json"
  },
  "risk_factors": [
   {
    "level": 0,
    "name": "Gender",
    "range": [
     0,
     1
    ]
   },
   {
    "level": 0,
    "name": "Age",
    "range": [
     1,
     87
    ]
   },
   {
    "level": 0,
    "name": "Age2",
    "range": [
     1,
     7569
    ]
   },
   {
    "level": 0,
    "name": "Age3",
    "range": [
     1,
     658503
    ]
   },
   {
    "level": 0,
    "name": "SES",
    "range": [
     -2.316299,
     2.296689
    ]
   },
   {
    "level": 1,
    "name": "Sodium",
    "range": [
     1.127384,
     8.656519
    ]
   },
   {
    "level": 1,
    "name": "Protein",
    "range": [
     43.50682,
     238.4145
    ]
   },
   {
    "level": 1,
    "name": "Fat",
    "range": [
     45.04756,
     382.664098658922
    ]
   },
   {
    "level": 2,
    "name": "PA",
    "range": [
     22.22314,
     9765.512
    ]
   },
   {
    "level": 2,
    "name": "Energy",
    "range": [
     1326.14051277588,
     7522.496
    ]
   },
   {
    "level": 3,
    "name": "BMI",
    "range": [
     13.88,
     39.48983
    ]
   }
  ],
  "ses_model": {
   "function_name": "normal",
   "function_parameters": [
    0.0,
    1.0
   ]
  }
 },
 "output": {
  "comorbidities": 5,
  "file_name": "HealthGPS_Result_{TIMESTAMP}.json",
  "folder": "/private/tmp/claude-501/-Users-jude-work-hpgs/11bb6248-4ad4-46d9-b863-8057526b3ac6/scratchpad/hi-out"
 },
 "project_requirements": {
  "demographics": {
   "age": true,
   "ethnicity": false,
   "gender": true,
   "gender2": "male",
   "region": false
  },
  "income": {
   "adjust_to_factors_mean": false,
   "categories": "3",
   "enabled": true,
   "income_based_csv_output": true,
   "trended": false,
   "type": "categorical"
  },
  "physical_activity": {
   "adjust_to_factors_mean": false,
   "enabled": true,
   "trended": false,
   "type": "simple"
  },
  "risk_factors": {
   "adjust_to_factors_mean": true,
   "trended": true
  },
  "trend": {
   "enabled": false,
   "type": "null"
  },
  "two_stage": {
   "use_logistic": false
  }
 },
 "running": {
  "diseases": [
   "alzheimer",
   "asthma",
   "colorectalcancer",
   "diabetes",
   "lowbackpain",
   "osteoarthritisknee",
   "anxiety",
   "dermatitis",
   "cataract",
   "pulmonar",
   "pancreatitis",
   "cirrhosis",
   "gallbladder",
   "reflux",
   "gout",
   "depression",
   "migraine",
   "multiplesclerosis",
   "parkinson",
   "psoriasis",
   "arthritis",
   "visionimpairment",
   "intracerebralhemorrhage",
   "ischemicheartdisease",
   "ischemicstroke",
   "subarachnoidhemorrhage",
   "breastcancer",
   "esophaguscancer",
   "gallbladdercancer",
   "kidneycancer",
   "livercancer",
   "ovarycancer",
   "pancreascancer",
   "stomachcancer",
   "thyroidcancer"
  ],
  "interventions": {
   "active_type_id": "food_labelling",
   "types": {
    "dynamic_marketing": {
     "active_period": {
      "finish_time": 2050,
      "start_time": 2022
     },
     "dynamics": [
      0.15,
      0.0,
      0.0
     ],
     "impacts": [
      {
       "from_age": 5,
       "impact_value": -0.12,
       "risk_factor": "BMI",
       "to_age": 12
      },
      {
       "from_age": 13,
       "impact_value": -0.31,
       "risk_factor": "BMI",
       "to_age": 18
      },
      {
       "from_age": 19,
       "impact_value": -0.16,
       "risk_factor": "BMI",
       "to_age": null
      }
     ]
    },
    "fiscal": {
     "active_period": {
      "finish_time": 2050,
      "start_time": 2022
     },
     "impact_type": "optimist",
     "impacts": [
      {
       "from_age": 5,
       "impact_value": -0.01742,
       "risk_factor": "Energy",
       "to_age": 9
      },
      {
       "from_age": 10,
       "impact_value": -0.01812,
       "risk_factor": "Energy",
       "to_age": 17
      },
      {
       "from_age": 18,
       "impact_value": -0.00563,
       "risk_factor": "Energy",
       "to_age": null
      }
     ]
    },
    "food_labelling": {
     "active_period": {
      "finish_time": 2050,
      "start_time": 2022
     },
     "adjustments": [
      {
       "risk_factor": "Energy",
       "value": 0.55
      }
     ],
     "child_cutoff_age": 18,
     "coefficients": [
      0.012,
      0.013,
      0.014,
      0.016
     ],
     "coverage_cutoff_time": 4,
     "coverage_rates": [
      0.26,
      0.7
     ],
     "impacts": [
      {
       "from_age": 1,
       "impact_value": -0.0103,
       "risk_factor": "BMI",
       "to_age": null
      }
     ]
    },
    "marketing": {
     "active_period": {
      "finish_time": 2050,
      "start_time": 2022
     },
     "impacts": [
      {
       "from_age": 5,
       "impact_value": -0.12,
       "risk_factor": "BMI",
       "to_age": 12
      },
      {
       "from_age": 13,
       "impact_value": -0.31,
       "risk_factor": "BMI",
       "to_age": 18
      },
      {
       "from_age": 19,
       "impact_value": -0.16,
       "risk_factor": "BMI",
       "to_age": null
      }
     ]
    },
    "physical_activity": {
     "active_period": {
      "finish_time": 2050,
      "start_time": 2022
     },
     "coverage_rates": [
      0.9
     ],
     "impacts": [
      {
       "from_age": 6,
       "impact_value": -0.16,
       "risk_factor": "BMI",
       "to_age": 15
      },
      {
       "from_age": 16,
       "impact_value": -0.08,
       "risk_factor": "BMI",
       "to_age": null
      }
     ]
    },
    "simple": {
     "active_period": {
      "finish_time": 2022,
      "start_time": 2022
     },
     "impact_type": "absolute",
     "impacts": [
      {
       "from_age": 0,
       "impact_value": -1.0,
       "risk_factor": "BMI",
       "to_age": null
      }
     ]
    }
   }
  },
  "seed": 123456789,
  "start_time": 2010,
  "stop_time": 2050,
  "trial_runs": 1
 },
 "version": 2
}