{
  "$schema": "schemas/v2/config.json",
  "data": {
    "checksum": "b68abc8d40b937d377aa7357bff66a1f4f5196da5b867f7ca88d02b37d2ebb5c",
    "source": "https://github.com/imperialCHEPI/healthgps-data/releases/download/20240624/data_20240624.zip"
  },
  "inputs": {
    "dataset": {
      "columns": {
        "Age": "integer",
        "Age2": "integer",
        "Age3": "integer",
        "Carbohydrate": "double",
        "EnergyIntake": "double",
        "Fat": "double",
        "Gender": "integer",
        "Height": "double",
        "Income": "integer",
        "PhysicalActivity": "double",
        "Protein": "double",
        "Sector": "integer",
        "Sodium": "double",
        "Weight": "double"
      },
      "delimiter": ",",
      "encoding": "ASCII",
      "format": "csv",
      "name": "../../../hgps_main_examples/KevinHall_India/India.DataFile.csv"
    },
    "settings": {
      "age_range": [
        0,
        100
      ],
      "country_code": "IND",
      "size_fraction": 1e-05
    }
  },
  "modelling": {
    "baseline_adjustments": {
      "delimiter": ",",
      "encoding": "ASCII",
      "file_names": {
        "factorsmean_female": "../../../hgps_main_examples/KevinHall_India/FactorsMean.Female.csv",
        "factorsmean_male": "../../../hgps_main_examples/KevinHall_India/FactorsMean.Male.csv"
      },
      "format": "csv"
    },
    "policy_start_year": 2024,
    "risk_factor_models": {
      "dynamic": "../../../hgps_main_examples/KevinHall_India/dynamic_model.json",
      "static": "../../../hgps_main_examples/KevinHall_India/static_model.json"
    },
    "risk_factors": [
      {
        "level": 0,
        "name": "Gender",
        "range": [
          0,
          1
        ]
      },
      {
        "level": 0,
        "name": "Age",
        "range": [
          0,
          100
        ]
      },
      {
        "level": 0,
        "name": "Sector",
        "range": [
          0,
          1
        ]
      },
      {
        "level": 0,
        "name": "Income",
        "range": [
          1,
          3
        ]
      },
      {
        "level": 1,
        "name": "FoodCarbohydrate",
        "range": [
          18.98039,
          1314.469065984
        ]
      },
      {
        "level": 1,
        "name": "FoodFat",
        "range": [
          1.354973,
          529.6070132192
        ]
      },
      {
        "level": 1,
        "name": "FoodProtein",
        "range": [
          4.091681,
          445.473773784
        ]
      },
      {
        "level": 1,
        "name": "FoodSodium",
        "range": [
          5.515374,
          61238.5989752
        ]
      },
      {
        "level": 1,
        "name": "Carbohydrate",
        "range": [
          18.98039,
          1314.469065984
        ]
      },
      {
        "level": 1,
        "name": "Fat",
        "range": [
          1.354973,
          529.6070132192
        ]
      },
      {
        "level": 1,
        "name": "Protein",
        "range": [
          4.091681,
          445.473773784
        ]
      },
      {
        "level": 1,
        "name": "Sodium",
        "range": [
          5.515374,
          61238.5989752
        ]
      },
      {
        "level": 2,
        "name": "PhysicalActivity",
        "range": [
          1.388473,
          1.835487
        ]
      },
      {
        "level": 2,
        "name": "EnergyIntake",
        "range": [
          148.44214,
          6783.8416544739
        ]
      },
      {
        "level": 3,
        "name": "Weight",
        "range": [
          3.319358,
          92.56391
        ]
      },
      {
        "level": 3,
        "name": "Height",
        "range": [
          51.87618,
          189.5827
        ]
      },
      {
        "level": 3,
        "name": "BMI",
        "range": [
          13.88,
          39.48983
        ]
      }
    ],
    "ses_model": {
      "function_name": "normal",
      "function_parameters": [
        0.0,
        1.0
      ]
    }
  },
  "output": {
    "comorbidities": 5,
    "file_name": "HealthGPS_Result_{TIMESTAMP}.json",
    "folder": "${HOME}/healthgps/results/india"
  },
  "project_requirements": {
    "demographics": {
      "age": true,
      "ethnicity": false,
      "gender": true,
      "gender2": "male",
      "region": false
    },
    "income": {
      "adjust_to_factors_mean": false,
      "categories": "3",
      "enabled": true,
      "income_based_csv_output": true,
      "trended": false,
      "type": "categorical"
    },
    "physical_activity": {
      "adjust_to_factors_mean": false,
      "enabled": true,
      "trended": false,
      "type": "simple"
    },
    "risk_factors": {
      "adjust_to_factors_mean": true,
      "trended": true
    },
    "trend": {
      "enabled": true,
      "type": "income_trend"
    },
    "two_stage": {
      "use_logistic": false
    }
  },
  "running": {
    "diseases": [
      "ischemicheartdisease",
      "diabetes",
      "intracerebralhemorrhage",
      "ischemicstroke",
      "asthma",
      "subarachnoidhemorrhage",
      "chronickidneydisease"
    ],
    "interventions": {
      "active_type_id": "simple",
      "types": {
        "simple": {
          "active_period": {
            "finish_time": null,
            "start_time": 2022
          },
          "impact_type": "absolute",
          "impacts": []
        }
      }
    },
    "seed": 123456789,
    "start_time": 2022,
    "stop_time": 2026,
    "trial_runs": 1
  },
  "version": 2
}
